{
  "schema_version": "agentflow.project_index.document_summary.v1",
  "doc_id": "readme",
  "path": "README.md",
  "title": "Fixture README",
  "kind": "readme",
  "content_sha256": "4444444444444444444444444444444444444444444444444444444444444444",
  "mtime": "2026-05-11T00:00:00.000Z",
  "summary": "Fixture README documents package usage.",
  "sections": [
    {
      "title": "Usage",
      "anchor": "usage",
      "line_start": 1,
      "line_end": 12
    }
  ],
  "anchors": ["usage"],
  "source": {
    "path": "README.md",
    "content_sha256": "4444444444444444444444444444444444444444444444444444444444444444"
  }
}
